{
  "id": "sub_001",
  "name": "",
  "description": "",
  "related_characters": [],
  "connection_to_main": "",
  "start_chapter": 1,
  "resolution_chapter": 10,
  "thematic_function": "",
  "status": "planned",
  "beats": [
    {
      "chapter": 1,
      "event": "",
      "impact": "medium"
    }
  ]
}
